{
  "contract": "summa.billing-source-origin",
  "version": "1.0.0",
  "sourceApplication": "chrona",
  "sourceId": "ACT-100",
  "sourceVersion": "rev-3",
  "origin": {
    "lineage": [
      {
        "from": "OBS-001",
        "origin": {
          "contract": "chrona.time-observation-origin",
          "version": "1.0.0",
          "sourceSystem": "praxis",
          "originActor": {
            "kind": "agent",
            "id": "anthropic/claude-code",
            "provider": "anthropic",
            "model": "unknown",
            "runtime": "claude-code"
          },
          "originExecution": "EXE-20260926T100000000Z-c3c3c3c3"
        }
      }
    ]
  }
}
