{
  "contract": "summa.billing-source-origin",
  "version": "1.0.0",
  "sourceApplication": "chrona",
  "sourceId": "ACT-101",
  "sourceVersion": "rev-3",
  "origin": {
    "lineage": [
      {
        "from": "OBS-001",
        "origin": {
          "contract": "chrona.time-observation-origin",
          "version": "1.0.0",
          "sourceSystem": "praxis",
          "originActor": {
            "kind": "agent",
            "id": "anthropic/claude-code",
            "provider": "anthropic",
            "model": "unknown",
            "runtime": "claude-code"
          },
          "originExecution": "EXE-20260926T100000000Z-c3c3c3c3",
          "provenance": {
            "contract": "praxis.provenance-record",
            "version": "1.0.0",
            "subject": "praxis:work/GH-12",
            "contributions": {
              "EXE-20260926T100000000Z-c3c3c3c3": {
                "operations": [
                  "created"
                ],
                "at": "2026-09-26T10:00:00.000Z",
                "actor": {
                  "kind": "agent",
                  "id": "anthropic/claude-code",
                  "provider": "anthropic",
                  "model": "unknown",
                  "runtime": "claude-code"
                }
              }
            }
          }
        }
      }
    ]
  }
}
